<?xml version="1.0" encoding="UTF-8" standalone="no"?><Users xmlns:xsi="http://www.w3.org/2001/XMLSchema-instance" xsi:noNamespaceSchemaLocation="Users.xsd">
	<user>
		<nickname losses="9" time="342" wins="13">Roman</nickname>
		<password>bola</password>
		<nationality>Portugal</nationality>
		<age>24</age>
		<picture>/Users/roman/Desktop/d.pdf</picture>
		<color>#91cec4</color>
	</user>
	<user>
		<nickname losses="14" time="229" wins="4">Eduardo</nickname>
		<password>qwerty</password>
		<nationality>Afghanistan</nationality>
		<age>15</age>
		<picture>/Users/roman/Desktop/d.pdf</picture>
		<color>#428b25</color>
	</user>
	<user>
		<nickname losses="0" time="0" wins="0">qweq</nickname>
		<password>sad</password>
		<nationality>Andorra</nationality>
		<age>23</age>
		<picture/>
		<color>#428b25</color>
	</user>
	<user>
		<nickname losses="0" time="20" wins="2">Andre</nickname>
		<password>123</password>
		<nationality>Armenia</nationality>
		<age>30</age>
		<picture>/Users/roman/Desktop/GoToGate_FB volta.html</picture>
		<color>#428b25</color>
	</user>
	<user>
		<nickname losses="0" time="9" wins="1">LOL</nickname>
		<password>1212</password>
		<nationality>Uruguay</nationality>
		<age>22</age>
		<picture>/Users/roman/Desktop/GoToGate_FB volta.html</picture>
		<color>#428b25</color>
	</user>
	<user>
		<nickname losses="1" time="39" wins="1">teste</nickname>
		<password>zxcv</password>
		<nationality>Israel</nationality>
		<age>50</age>
		<picture>/Users/roman/Desktop/Hor√°rio ISEl</picture>
		<color>#428b25</color>
	</user>
</Users>